artigo_id_unico;titulo_unico;consulta_nome;base;autores;ano;abstract;journal;tipo_documento2;url;volume;pages;ISSN_ISBN;DOI;Excluir-2revisores2
1115;COMMUNITY DISCOVERY AND SENTIMENT MINING FOR CHINESE BLOG;IEEE_B;IEEE;Hui Yang and Bin Yang and Xu Zhou and Chunguang Zhou and Zhe Wang and Zhou Chai;2010;Since the emergence of BLOG, it not only represents a new network technology, but also means the beginning of a new life style. How to utilize and mine the BLOG content which contains hidden sentiment and real-time update is a big challenge in the data-mining domain. As most of the existing method for network texts topic mining is achieved through clustering texts topic and label which are labeled by hand and often mismatched with the content of the text, the accuracy rating of this method is low. In this paper, we present a BLOG community mining method based on topic features. We define topic features as representation for the major contents of BLOG. Meanwhile, we present a BLOG hidden sentiment continuous evaluation algorithm, called CSETR (Continuous sentiment evaluation with time regulator). CSETR can be used to evaluate the continuous sentiment scores of topic features. Furthermore, it also consider changes in sentiment intensity over time. Lastly, through CSETR we will build up sentiment trend model for Chinese BLOG community.;Fuzzy Systems and Knowledge Discovery (FSKD), 2010 Seventh International Conference on;NULO;NULO;4;1740-1745;10.1109/FSKD.2010.5569402;NULO;Excluir
1116;COMPARATIVE ANALYSIS OF THE TECHNIQUES FOR SENTIMENT ANALYSIS;IEEE_B;IEEE;Ghag, K. and Shah, K.;2013;Sentiment Analysis deals with identifying and aggregating the sentiment or opinions expressed by the users. Sentiment Analysis could be carried out by techniques that may or may not use a lexicon for polarity identification. Training data set i.e. already tagged opinions may or may not be used. Some sentiment analyser could be language dependent or some could be language independent, also called as multilingual sentiment analysers. A detailed survey on different techniques used in Sentiment Analysis is carried out. These techniques are then compared on the basis of usage of lexicon, requirement of training set and language dependency. These are then summarised and analysed. General Challenges are also discussed.;Advances in Technology and Engineering (ICATE), 2013 International Conference on;NULO;NULO;NULO;1-7;10.1109/ICAdTE.2013.6524752;NULO;Incluir
1117;COMPARISON OF FEATURE SELECTION METHODS FOR SENTIMENT ANALYSIS;SCOPUS;SCOPUS;Nicholls, C. and Song, F.;2010;Sentiment analysis is a sub-field of Natural Language Processing and involves automatically classifying input text according to the sentiment expressed in it. Sentiment analysis is similar to topical text classification but has a significant contextual difference that needs to be handled. Based on this observation we propose a new feature selection method called Document Frequency Difference to automatically identify the words which are more useful for classifying sentiment. We further compare it to three other feature selection methods and show that it can help improve sentiment classification performance. Â© 2010 Springer-Verlag Berlin Heidelberg.;Lecture Notes in Computer Science (including subseries Lecture Notes in Artificial Intelligence and Lecture Notes in Bioinformatics);Conference Paper;http://www.scopus.com/inward/record.url?eid=2-s2.0-77953803911&partnerID=40&md5=c42ca29e86e6ce83ee51a0f38737df2b;6085 LNAI;286-289;10.1007/978-3-642-13059-5_30;NULO;Excluir
1118;COMPARISON OF MODEL-BASED LEARNING METHODS FOR FEATURE-LEVEL OPINION MINING;IEEE_A;IEEE;Luole Qi and Li Chen;2011;The tasks of feature-level opinion mining usually include the extraction of product entities from product reviews, the identification of opinion words that are associated with the entities, and the determining of these opinions polarities (e.g., positive, negative, or neutral). In recent years, several approaches have been proposed such as rule-based and statistical methods on this subject, but few attentions have been paid to applying more discriminative learning models to achieve the goal. On the other hand, little work has evaluated their algorithms performance for identifying intensifiers, entity phrases and infrequent entities. In this paper, we in particular adopt the Conditional Random Fields (CRFs) model to perform the opinion mining tasks. Relative to related approaches, we have not only highlighted the algorithms ability in mining intensifiers, phrases and infrequent entities, but also integrated more elements in the model so as to optimize its training and decoding process. Our method was compared to the lexicalized Hidden Markov Model (L-HMMs) based opinion mining method in the experiment, which proves its significantly better accuracy from several aspects.;Web Intelligence and Intelligent Agent Technology (WI-IAT), 2011 IEEE/WIC/ACM International Conference on;NULO;NULO;1;265-273;10.1109/WI-IAT.2011.64;NULO;Incluir
1119;COMPARISON OF TOURISM DATA USING DOUBLE RANKING;IEEE_B;IEEE;Hirokawa, S. and Jun Zeng;2011;The prompt discovery and mining of users reputation, opinion and complaint are becoming a hot topic in the field of search engine for Blog and Twitter. This paper proposes --Double Rank-- method to analyze the search result using two viewpoints, where the polarity degree of keywords in the search results are evaluated from the viewpoints. Most previous researches concern mainly in positive and negative evaluation as for the polarity degree. Two viewpoints are specified as the search condition in the present paper. The blog articles related to sightseeing are analyzed as case studies, where the characteristics and the sightseeing situation are compared for two prefectures.;Software and Network Engineering (SSNE), 2011 First ACIS International Symposium on;NULO;NULO;NULO;67-72;10.1109/SSNE.2011.28;NULO;Excluir
1120;COMPONENT ANALYSIS OF A SENTIMENT ANALYSIS FRAMEWORK ON DIFFERENT CORPORA;IEEE_B;IEEE;Medhat, W. and Yousef, A.H. and Mohamed, H.K.;2014;Sentiment Analysis (SA) is the computational study of peoples opinions about certain topics. With the massive growth of web 2.0 technologies, many sources of data and corpora are available for SA. There are some recent frameworks proposed in this field that can deal with different corpora. This paper presents a component analysis of recently proposed sentiment analysis framework. The framework components are divided to three stages, each of which contains many alternatives. The first stage is the text processing which include handling negations, removing stopwords, and using selective words of part-of-speech tags. The second stage is the feature extractions which are unigrams and bigrams. The third stage is the text classification which was done using Nai¨ve Bayes and Decision Tree classifiers. It is important to analyze the components of the framework to configure which scenario is better for each corpus used. The analysis is enhanced by applying the framework components on the benchmark corpus movie reviews in addition to the prepared corpora from online social network sites and a review site. The results show that applying all the stages of text processing techniques ultimately decrease the classifiers training time with no significant penalty in accuracy. The results also show that Nai¨ve Bayes gives higher accuracy in case of balanced benchmark corpus while Decision tree classifier is better for imbalance data from social network.;Computer Engineering Systems (ICCES), 2014 9th International Conference on;NULO;NULO;NULO;300-306;10.1109/ICCES.2014.7030976;NULO;Incluir
1121;CONCEPTUAL LEVEL SIMILARITY MEASURE BASED REVIEW SPAM DETECTION;IEEE_B;IEEE;Algur, S.P. and Patil, A.P. and Hiremath, P.S. and Shivashankar, S.;2010;Today E-commerce popularity has made web an excellent source of gathering customer reviews / opinions about a product that they have purchased. The number of customer reviews that a product receives is growing at a very fast rate (It could be in hundreds or thousands). Opinion mining from product reviews, forum posts and blogs is an important research topic today with many applications. However, existing research is more focused towards classification and summarization of these online opinions. An important issue related to the trustworthiness of online opinions has been neglected most often. There is no reported study on assessing the trustworthiness of reviews, which is crucial for all opinion based applications, although web spam and email spam have been investigated extensively. In this paper, we make an attempt to detect whether a review is a spam or a non spam review, in order to provide a trusted review to help the customer in taking the proper buying decision. The trustworthiness of the reviews is assessed as spam or a non spam review which includes both duplicate and near duplicate reviews classified as spam reviews, and partially related and unique reviews classified as non spam reviews. We propose a novel and effective technique, namely, Conceptual level similarity measure used for detecting spam reviews based on the product features that have been commented in the reviews. Experimental results demonstrate the effectiveness of the proposed technique in detecting spam and non spam reviews. The efficiency of the task of web based customer review spam detection can be enhanced by identifying and eliminating duplicate and near duplicate spam reviews, thereby providing a summary of the trusted reviews for customers to make buying decisions.;Signal and Image Processing (ICSIP), 2010 International Conference on;NULO;NULO;NULO;416-423;10.1109/ICSIP.2010.5697509;NULO;Excluir
1122;CONFIDENCE ESTIMATION AND REPUTATION ANALYSIS IN ASPECT EXTRACTION;SCOPUS;SCOPUS;Li, Y. and Wang, H. and Qin, Z. and Xu, W. and Guo, J.;2014;Extracting product aspects and their associated sentiments is one of the key tasks in sentiment analysis. Estimating the confidences of extracted aspects is important to ensure the performance. To tackle the issue, this paper proposes a two-step estimation method. Collocations of product features and opinion words are initially extracted through pattern bootstrapping. A criterion synthesizing two measurements, Popularity and Reliability, is novelly exploited to assess both patterns and features. Then the features are further clustered into aspects based on path similarities in the Word Net. Each cluster is assigned a weight based on its Compactness and Texture, and the light ones are filtered out. In addition, this paper also captures global aspect reputations by aggregating sentiment strengths through opinion collocations. Experimental results on a benchmark data set with 5 products demonstrate the effectiveness and reliability of our proposed method.;Proceedings - International Conference on Pattern Recognition;Conference Paper;http://www.scopus.com/inward/record.url?eid=2-s2.0-84919917570&partnerID=40&md5=a6af26459953d66f1d872cc80446ae6f;NULO;3612-3617;10.1109/ICPR.2014.621;NULO;Incluir
1123;CONTENTS;IEEE_B;IEEE;ERRO;2014;The following topics are dealt with: big data analytics framework:, Thai public opinion mining:, programming teaching aid:, rule-based fruit image segmentation:, tomato recognition:, breast cancer detection:, digital mammograms:, flight departure delay distributions:, attendance management system:, range meters:, MEMS based IMU:, multiaxis system:, CSMA-CA wireless sensor network:, e-health care systems:, IPv4:, IPv6:, interoperability issues:, OpenFlow enabled network:, square root algorithm:, graph-based volumetric segmentation:, flower image classification:, neural network:, shared secret-based steganography:, medical data protection:, Android steganography:, broad band impulsive noise source:, DC motor position control:, FM chirp:, GNU radio-based FMCW radar:, multiple target detection:, sequential data encoding:, video coding:, parallel multilingual named entity corpus:, urban forest health monitoring:, genetic algorithm:, PAPR reduction:, SLM wavelet-OFDM systems:, thin slab artificial dielectric materials:, signal processing:, SFCW radars:, handwritten alphabet recognition:, directional feature extraction:, self organizing maps:, shooting aircraft event animation simulation:, IFS fractal model:, semantic mapping:, aircraft propeller simulation:, microcontroller-based programmable phase shifter:, array antenna systems:, EEG signals:, and UAV landing control systems.;Computer, Control, Informatics and Its Applications (IC3INA), 2014 International Conference on;NULO;NULO;NULO;i-iii;10.1109/IC3INA.2014.7042590;NULO;Excluir
1124;CREDIBILITY EVALUATION AND RESULTS WITH LEADER-WEIGHT IN OPINION MINING;SCOPUS;SCOPUS;Cho, K.S. and Ryu, J.-S. and Jeong, J.-H. and Kim, Y.-H. and Kim, U.-M.;2010;A plethora of information is recently flooding the Internet with a rapid surge in Internet usage. Information easily available on the Internet help researchers understand people they study. The existing techniques of the opinion mining usually consist of sentiment classification, feature-based opinion mining, summarization, comparative sentence and relation mining, opinion search, opinion spam, and the linguistic dictionary construction such as the WordNet. This paper, however, proposes differing methods of opinion mining from existing ones. The methods we present here enable credibility evaluation and result conversion using influence of each opinion holder on the Internet and their personal information, which are an analysis-result of LIWC, including their background information and tendency. Â© 2010 IEEE.;Proceedings - 2010 International Conference on Cyber-Enabled Distributed Computing and Knowledge Discovery, CyberC 2010;Conference Paper;http://www.scopus.com/inward/record.url?eid=2-s2.0-78649810152&partnerID=40&md5=186096c4bc44fe66304a4408c8f87467;NULO;5-8;10.1109/CyberC.2010.12;NULO;Excluir
1125;CRF BASED ON LHFS APPLIED ON SENTIMENT CLASSIFICATION;SCOPUS;SCOPUS;Zhu, J.;2012;Sentiment classification has attracted increasing interest from natural language processing. This paper applies CRF(Conditional Random Filed) based on LHFS (Local High-Frequency Strings) method on sentence sentiment analysis. This method can effectively solve ordinal regression problems. In this method, sentences are labeled to determine their polarity, and LHFS method is used to expand the set of sentiment features. Experiments on sentiment classification indicate that the accuracy of CRF model is increased up to 2.1%, with the help of LHFS method, which is much better than that of HMM and MEMM. Â© 2012 IEEE.;Proceedings - 2012 International Conference on Computer Science and Electronics Engineering, ICCSEE 2012;Conference Paper;http://www.scopus.com/inward/record.url?eid=2-s2.0-84861075723&partnerID=40&md5=c463161d789fd9a28c12dfebaf547f5e;1;217-219;10.1109/ICCSEE.2012.190;NULO;Excluir
1126;CRO: A SYSTEM FOR ONLINE REVIEW STRUCTURIZATION;SCOPUS;SCOPUS;Liu, H.a  and Yang, H.b  and Li, W.c  and Wei, W.d  and He, J.d  and Du, X.d;2008;In this paper, we present a system called CRO (Chinese Review Observer) for online product review structurization. By Structurization, we mean identifying, extracting and summarizing information from unstructured review text to a structured table. The core tasks include review collection, product feature and user opinion extraction, and polarity analysis of opinions. Existing research in this area is mainly English text oriented. To deal with Chinese effectively, we propose several novel approaches for fulfilling the core tasks. Then we integrated these approaches and implement the whole procedure of review structurization in the system CRO. Running results for reviews of real products show its performance is satisfactory.;Proceedings of the ACM SIGKDD International Conference on Knowledge Discovery and Data Mining;Conference Paper;http://www.scopus.com/inward/record.url?eid=2-s2.0-65449115760&partnerID=40&md5=d9a6916e0add88a76df2ccb7ecbfa4d9;NULO;1085-1088;10.1145/1401890.1402025;NULO;Excluir
1127;CROSS-DOMAIN SENTIMENT CLASSIFICATION USING A SENTIMENT SENSITIVE THESAURUS;IEEE_B;IEEE;Bollegala, D. and Weir, D. and Carroll, J.;2013;Automatic classification of sentiment is important for numerous applications such as opinion mining, opinion summarization, contextual advertising, and market analysis. Typically, sentiment classification has been modeled as the problem of training a binary classifier using reviews annotated for positive or negative sentiment. However, sentiment is expressed differently in different domains, and annotating corpora for every possible domain of interest is costly. Applying a sentiment classifier trained using labeled data for a particular domain to classify sentiment of user reviews on a different domain often results in poor performance because words that occur in the train (source) domain might not appear in the test (target) domain. We propose a method to overcome this problem in cross-domain sentiment classification. First, we create a sentiment sensitive distributional thesaurus using labeled data for the source domains and unlabeled data for both source and target domains. Sentiment sensitivity is achieved in the thesaurus by incorporating document level sentiment labels in the context vectors used as the basis for measuring the distributional similarity between words. Next, we use the created thesaurus to expand feature vectors during train and test times in a binary classifier. The proposed method significantly outperforms numerous baselines and returns results that are comparable with previously proposed cross-domain sentiment classification methods on a benchmark data set containing Amazon user reviews for different types of products. We conduct an extensive empirical analysis of the proposed method on single- and multisource domain adaptation, unsupervised and supervised domain adaptation, and numerous similarity measures for creating the sentiment sensitive thesaurus. Moreover, our comparisons against the SentiWordNet, a lexical resource for word polarity, show that the created sentiment-sensitive thesaurus accurately captures words that express similar s- ntiments.;Knowledge and Data Engineering, IEEE Transactions on;NULO;NULO;25;1719-1731;10.1109/TKDE.2012.103;1041-4347;Excluir
1128;CROSS-LANGUAGE OPINION TARGET EXTRACTION IN REVIEW TEXTS;IEEE_B;IEEE;Xinjie Zhou and Xiaojun Wan and Jianguo Xiao;2012;Opinion target extraction is a subtask of opinion mining which is very useful in many applications. In this study, we investigate the problem in a cross-language scenario which leverages the rich labeled data in a source language for opinion target extraction in a different target language. The English labeled corpus is used as training set. We generate two Chinese training datasets with different features. Two labeling models for Chinese opinion target extraction are learned based on Conditional Random Fields (CRF). After that, we use a monolingual co-training algorithm to improve the performance of both models by leveraging the enormous unlabeled Chinese review texts on the web. Experimental results show the effectiveness of our proposed approach.;Data Mining (ICDM), 2012 IEEE 12th International Conference on;NULO;NULO;NULO;1200-1205;10.1109/ICDM.2012.32;1550-4786;Excluir
1129;DATA REPRESENTATION IN MACHINE LEARNING-BASED SENTIMENT ANALYSIS OF CUSTOMER REVIEWS;SCOPUS;SCOPUS;Shamshurin, I.;2011;In this paper, we consider the problem of extracting opinions from natural language texts, which is one of the tasks of sentiment analysis. We provide an overview of existing approaches to sentiment analysis including supervised (Naive Bayes, maximum entropy, and SVM) and unsupervised machine learning methods. We apply three supervised learning methods-Naive Bayes, KNN, and a method based on the Jaccard index - to the dataset of Internet user reviews about cars and report the results. When learning a user opinion on a specific feature of a car such as speed or comfort, it turns out that training on full unprocessed reviews decreases the classification accuracy. We experiment with different approaches to preprocessing reviews in order to obtain representations that are relevant for the feature one wants to learn and show the effect of each representation on the accuracy of classification. Â© 2011 Springer-Verlag Berlin Heidelberg.;Lecture Notes in Computer Science (including subseries Lecture Notes in Artificial Intelligence and Lecture Notes in Bioinformatics);Conference Paper;http://www.scopus.com/inward/record.url?eid=2-s2.0-79960138448&partnerID=40&md5=52f412734799a4b72696819cb890eaf6;6744 LNCS;254-260;10.1007/978-3-642-21786-9_42;NULO;Incluir
1130;DATA-DRIVEN VS. DICTIONARY-BASED WORD N-GRAM FEATURE INDUCTION FOR SENTIMENT ANALYSIS;SCOPUS;SCOPUS;Remus, R.a  and Rill, S.b  c;2013;We address the question which word n-gram feature induction approach yields the most accurate discriminative model for machine learning-based sentiment analysis within a specific domain: a purely data-driven word n-gram feature induction or a word n-gram feature induction based on a domain-specific or domain-non-specific polarity dictionary. We evaluate both approaches in document-level polarity classification experiments in 2 languages, English and German, for 4 analog domains each: user-written product reviews on books, DVDs, electronics and music. We conclude that while dictionary-based feature induction leads to large dimensionality reductions, purely data-driven feature induction yields more accurate discriminative models. Â© 2013 Springer-Verlag.;Lecture Notes in Computer Science (including subseries Lecture Notes in Artificial Intelligence and Lecture Notes in Bioinformatics);Conference Paper;http://www.scopus.com/inward/record.url?eid=2-s2.0-84886799667&partnerID=40&md5=789b2e6500c12de366b32b68cdbf5817;8105 LNAI;176-183;10.1007/978-3-642-40722-2_18;NULO;Excluir
1131;DEPENDENCY EXPANSION MODEL FOR SENTIMENT LEXICON EXTRACTION;IEEE_B;IEEE;Jiguang Liang and Jianlong Tan and Xiaofei Zhou and Ping Liu and Li Guo and Shuo Bai;2013;In this paper, we present a sentiment lexicon building method called dependency expansion method (DEM), which exploits the relations described in dependency trees between sentiment words and degree adverbs. By taking advantage of the observation that degree adverbs modify sentiment words, two extraction rules are made, through which sentiment words and degree adverbs can be effectively expanded. We evaluate performance on two product reviews corpora in Chinese. Experimental results show that our DEM can effectively extract sentiment words to support the review opinion analysis.;Web Intelligence (WI) and Intelligent Agent Technologies (IAT), 2013 IEEE/WIC/ACM International Joint Conferences on;NULO;NULO;3;62-65;10.1109/WI-IAT.2013.151;NULO;Excluir
1132;DEPENDENCY FOREST FOR SENTIMENT ANALYSIS;SCOPUS;SCOPUS;Tu, Z. and Jiang, W. and Liu, Q. and Lin, S.;2012;Dependency Grammars prove to be effective in improving sentiment analysis, because they can directly capture syntactic relations between words. However, most dependency-based systems suffer from a major drawback: they only use 1-best dependency trees for feature extraction, which adversely affects the performance due to parsing errors. Therefore, we propose an approach that applies dependency forest to sentiment analysis. A dependency forest compactly represents multiple dependency trees. We develop new algorithms for extracting features from dependency forest. Experiments show that our forest-based system obtains 5.4 point absolute improvement in accuracy over a bag-of-words system, and 1.3 point improvement over a tree-based system on a widely used sentiment dataset. Our forest-based system also achieves state-of-the-art performance on the sentiment dataset. Â© 2012 Springer-Verlag.;Communications in Computer and Information Science;Conference Paper;http://www.scopus.com/inward/record.url?eid=2-s2.0-84869203256&partnerID=40&md5=82deced788d94fb5cb4551926f6c998a;333 CCIS;69-77;10.1007/978-3-642-34456-5_7;NULO;Incluir
1133;DEPENDENCY TREE-BASED RULES FOR CONCEPT-LEVEL ASPECT-BASED SENTIMENT ANALYSIS;SCOPUS;SCOPUS;Poria, S.a  d  and Ofek, N.b  and Gelbukh, A.c  and Hussain, A.d  and Rokach, L.b;2014;Over the last few years, the way people express their opinions has changed dramatically with the progress of social networks, web communities, blogs, wikis, and other online collaborative media. Now, people buy a product and express their opinion in social media so that other people can acquire knowledge about that product before they proceed to buy it. On the other hand, for the companies it has become necessary to keep track of the public opinions on their products to achieve customer satisfaction. Therefore, nowadays opinion mining is a routine task for every company for developing a widely acceptable product or providing satisfactory service. Concept-based opinion mining is a new area of research. The key parts of this research involve extraction of concepts from the text, determining product aspects, and identifying sentiment associated with these aspects. In this paper, we address each one of these tasks using a novel approach that takes text as input and use dependency parse tree-based rules to extract concepts and aspects and identify the associated sentiment. On the benchmark datasets, our method outperforms all existing state-of-the-art systems.;Communications in Computer and Information Science;Article;http://www.scopus.com/inward/record.url?eid=2-s2.0-84908541648&partnerID=40&md5=6d1606cb981650b334bdbc99369f6a31;475;41-47;10.1007/978-3-319-12024-9_5;NULO;Incluir
