artigo_id_unico;titulo_unico;consulta_nome;base;autores;ano;abstract;journal;tipo_documento2;url;volume;pages;ISSN_ISBN;DOI;Excluir-2revisores2
1225;IMPACT OF CONTRAST MODIFICATION ON HUMAN FEELING: AN OBJECTIVE AND SUBJECTIVE ASSESSMENT;IEEE_B;IEEE;Zontone, P. and Carli, M. and Boato, G. and De Natale, F.G.B.;2010;Images are powerful means of communication. Adding images to documents, websites, magazines, helps attracting the attention and providing an immediate feeling about the content of the document itself. At the same time, images can be used to influence the attitude of the reader. In the digital era it is easier than ever to create and share multimedia documents making extensive use of visual data. Furthermore, it is extremely easy to modify and adapt the images in order to make them more suitable to convey a concept. These modifications may simply consist in focusing the attention on a specific part of the image, to heavier manipulations such as changing the visual appearance or the contents to bias the opinion of the observer. This creates a rising interest for the availability of automatic blind tools able to detect possible modifications of images, and to correlate these modifications with the relevant impact on the viewer. This paper proposes an example of application of these concepts that exploits a tool for automatic detection of contrast modifications and analyzes their impact on human feeling. The results of instrumental and subjective studies are presented and discussed.;Image Processing (ICIP), 2010 17th IEEE International Conference on;NULO;NULO;NULO;1757-1760;10.1109/ICIP.2010.5651509;1522-4880;Excluir
1226;IMPLEMENTATION OF AUTOMATED SENTIMENT DISCOVERY SYSTEM;SCOPUS;SCOPUS;Jawale, M.A. and Kyatanavar, D.N. and Pawar, A.B.;2014;Todays world completely depends on computer technologys advancement to get the best of whatever they want or choose. Because of internet, sharing and exchanging information is really easiest task than ever before. And same technology is providing us ample amount of data, information while selecting best of services, best of products available as well as best of individual based on quality features. Even due to various media of social information input like blogs, forums, communities, twits, etc. it is far superior to give feedback on any organization, services provided, product qualities, individual skills very easily and rapidly. Additionally like individual internet user, all kind of organization experts, management teams, analysts are focusing on such data and its analysis for their business growths and trends. In the same direction, this research paper focuses on development of automated opinion mining system to help, analyze, evaluate users reviews, and to provide on click solution of reviews mined for business decision making process. This paper explores an idea of extracting real time dataset through provided Graphical User Interface (GUI). On this extracted dataset, Part of Speech tagging is applied to get implicit as well as explicit features of the product. Then the orientation of opinions is identified. After this, the reviews are classified according to their orientation. The summarization unit would then generate opinion mining result in visualized form for further decision making process. In this system, dictionary based and corpus based approaches are combined together. Also it provides more accuracy in obtained results to make this system trustworthy and efficient.;International Conference on Recent Advances and Innovations in Engineering, ICRAIE 2014;Conference Paper;http://www.scopus.com/inward/record.url?eid=2-s2.0-84908636710&partnerID=40&md5=7520b17c9ba457278a082f06124db844;NULO;NULO;10.1109/ICRAIE.2014.6909307;NULO;Incluir
1227;IMPLICIT FEATURE EXTRACTION FOR SENTIMENT ANALYSIS IN CONSUMER REVIEWS;SCOPUS;SCOPUS;Schouten, K. and Frasincar, F.;2014;With the increasing popularity of aspect-level sentiment analysis, where sentiment is attributed to the actual aspects, or features, on which it is uttered, much attention is given to the problem of detecting these features. While most aspects appear as literal words, some are instead implied by the choice of words. With research in aspect detection advancing, we shift our focus to the less researched group of implicit features. By leveraging the co-occurrence between a set of known implicit features and notional words, we are able to predict the implicit feature based on the choice of words in a sentence. Using two different types of consumer reviews (product reviews and restaurant reviews), an F1-measure of 38% and 64% is obtained on these data sets, respectively. Â© Springer International Publishing Switzerland 2014.;Lecture Notes in Computer Science (including subseries Lecture Notes in Artificial Intelligence and Lecture Notes in Bioinformatics);Conference Paper;http://www.scopus.com/inward/record.url?eid=2-s2.0-84903554933&partnerID=40&md5=5c1cd3d68a13e980d18e62737696e6ac;8455 LNCS;228-231;10.1007/978-3-319-07983-7-31;NULO;Incluir
1228;IMPLICIT FEATURE IDENTIFICATION IN CHINESE REVIEWS USING EXPLICIT TOPIC MINING MODEL;SCOPUS;SCOPUS;Xu, H. and Zhang, F. and Wang, W.;2015;The essential work of feature-specific opinion mining is centered on the product features. Previous related research work has often taken into account explicit features but ignored implicit features, However, implicit feature identification, which can help us better understand the reviews, is an essential aspect of feature-specific opinion mining. This paper is mainly centered on implicit feature identification in Chinese product reviews. We think that based on the explicit synonymous feature group and the sentences which contain explicit features, several Support Vector Machine (SVM) classifiers can be established to classify the non-explicit sentences. Nevertheless, instead of simply using traditional feature selection methods, we believe an explicit topic model in which each topic is pre-defined could perform better. In this paper, we first extend a popular topic modeling method, called Latent Dirichlet Allocation (LDA), to construct an explicit topic model. Then some types of prior knowledge, such as: must-links, cannot-links and relevance-based prior knowledge, are extracted and incorporated into the explicit topic model automatically. Experiments show that the explicit topic model, which incorporates pre-existing knowledge, outperforms traditional feature selection methods and other existing methods by a large margin and the identification task can be completed better.;Knowledge-Based Systems;Article;http://www.scopus.com/inward/record.url?eid=2-s2.0-84923080938&partnerID=40&md5=9bbe8e251dac9db0c7a3fdfdbed7644c;76;166-175;10.1016/j.knosys.2014.12.012;NULO;Excluir
1229;IMPROVING SENTIMENT ANALYSIS BY GLOBAL FEATURE DIMENSION AND PARAMETER OPTIMIZATION IN SUPPORT VECTOR MACHINES;SCOPUS;SCOPUS;Li, X.a  and Zhou, Y.b  and Li, J.a  and Zhang, P.c;2012;Sentiment analysis has become an important component of business intelligence. While many researches rely on Support Vector Machine to perform text sentiment classification, few have studied global optimization of feature dimension and kernel function. We propose a holistic model that finds the optimized combination of feature dimension and SVM kernel. Our experiment shows that feature reduction alone does not always improve SVM-based sentiment analysis. However, SVM performance can be improved by optimizing feature dimension as well as optimizing SVM kernel function. Furthermore, finding a global optimization can generate the best performance in sentiment analysis.;22nd Workshop on Information Technologies and Systems, WITS 2012;Conference Paper;http://www.scopus.com/inward/record.url?eid=2-s2.0-84902485194&partnerID=40&md5=bc232ae7ba6dbbae0ad9cb615eb07431;NULO;121-126;NULO;NULO;Excluir
1230;IMPROVING SENTIMENT ANALYSIS IN AN ONLINE CANCER SURVIVOR COMMUNITY USING DYNAMIC SENTIMENT LEXICON;IEEE_B;IEEE;Ofek, N. and Caragea, C. and Rokach, L. and Biyani, P. and Mitra, P. and Yen, J. and Portier, K. and Greer, G.;2013;Online Health Communities is a major source for patients and their family members in the process of gathering information and seeking social support. The American Cancer Society Cancer Survivors Network has many users and presents a large number of users interactions with regards to coping with cancer. Sentiment analysis is an important step in understanding participants needs and concerns and the impact of users responses on other members. We present an automated approach for sentiment analysis in an online cancer survivor community and compare it with a previous sentiment analysis approach. Both approaches are machine learning based and are tested on the same dataset. However, this work uses features derived from a dynamic sentiment lexicon, whereas the previous work uses a general sentiment lexicon to extract features. Tested on several classifiers, with only six features (versus thirteen), our results show 2.3% improvement on average, in terms of accuracy, and greater improvement in F-measure and AUC. An additional experiment was conducted that showed a positive impact of dimensionality reduction by extracting abstract features, instead of using term frequency (TF) vector space as attribute values.;Social Intelligence and Technology (SOCIETY), 2013 International Conference on;NULO;NULO;NULO;109-113;10.1109/SOCIETY.2013.20;NULO;Excluir
1231;IMPROVING SENTIMENT CLASSIFICATION USING FEATURE HIGHLIGHTING AND FEATURE BAGGING;IEEE_B;IEEE;Lin Dai and Hechun Chen and Xuemei Li;2011;Sentiment classification is an important data mining task. Previous researches tried various machine learning techniques while didnt make fully use of the difference among features. This paper proposes a novel method for improving sentiment classification by fully exploring the different contribution of features. The method consists of two parts. First, we highlight sentimental features by increasing their weight. Second, we use bagging to construct multiple classifiers on different feature spaces and combine them into an aggregating classifier. Extensive experiments show that the method can evidently improve the performance of sentiment classification.;Data Mining Workshops (ICDMW), 2011 IEEE 11th International Conference on;NULO;NULO;NULO;61-66;10.1109/ICDMW.2011.96;NULO;Incluir
1232;INCORPORATING APPRAISAL EXPRESSION PATTERNS INTO TOPIC MODELING FOR ASPECT AND SENTIMENT WORD IDENTIFICATION;SCIENCE_DIRECT;SCIENCE_DIRECT;Xiaolin Zheng and Zhen Lin and Xiaowei Wang and Kwei-Jay Lin and Meina Song;2014;Abstract With the considerable growth of user-generated content, online reviews are becoming extremely valuable sources for mining customersâ€™ opinions on products and services. However, most of the traditional opinion mining methods are coarse-grained and cannot understand natural languages. Thus, aspect-based opinion mining and summarization are of great interest in academic and industrial research. In this paper, we study an approach to extract product and service aspect words, as well as sentiment words, automatically from reviews. An unsupervised dependency analysis-based approach is presented to extract Appraisal Expression Patterns (AEPs) from reviews, which represent the manner in which people express opinions regarding products or services and can be regarded as a condensed representation of the syntactic relationship between aspect and sentiment words. \{AEPs\} are high-level, domain-independent types of information, and have excellent domain adaptability. An AEP-based Latent Dirichlet Allocation (AEP-LDA) model is also proposed. This is a sentence-level, probabilistic generative model which assumes that all words in a sentence are drawn from one topic â€ a generally true assumption, based on our observation. The model also assumes that every review corpus is composed of several mutually corresponding aspect and sentiment topics, as well as a background word topic. The \{AEP\} information is incorporated into the AEP-LDA model for mining aspect and sentiment words simultaneously. The experimental results on reviews of restaurants, hotels, \{MP3\} players, and cameras show that the AEP-LDA model outperforms other approaches in identifying aspect and sentiment words.;Knowledge-Based Systems;NULO;http://www.sciencedirect.com/science/article/pii/S0950705114000434;61;29 - 47;http://dx.doi.org/10.1016/j.knosys.2014.02.003;0950-7051;Incluir
1233;INCORPORATING GUEST PREFERENCES INTO COLLABORATIVE FILTERING FOR HOTEL RECOMMENDATION;SCOPUS;SCOPUS;Fukumoto, F.a  and Sugiyama, H.b  and Suzuki, Y.a  and Matsuyoshi, S.a;2014;Collaborative filtering (CF) has been widely used as a filtering technique because it is not necessary to apply more complicated content analysis. However, it is difficult to take users' preferences/criteria related to the aspects of a product/hotel into account. This paper presents a method of hotel recommendation that incorporates different aspects of a product/hotel to improve quality of the score. We used the results of aspect-based sentiment analysis for guest preferences. The empirical evaluation using Rakuten Japanese travel data showed that aspect-based sentiment analysis improves overall performance. Moreover, we found that it is effective for finding hotels that have never been stayed at but share the same neighborhoods.;KDIR 2014 - Proceedings of the International Conference on Knowledge Discovery and Information Retrieval;Conference Paper;http://www.scopus.com/inward/record.url?eid=2-s2.0-84909966802&partnerID=40&md5=ad84da72fd1cb89bca3e819048c81940;NULO;22-30;NULO;NULO;Excluir
1234;INCORPORATING LANGUAGE PATTERNS AND DOMAIN KNOWLEDGE INTO FEATURE-OPINION EXTRACTION;SCOPUS;SCOPUS;Zhou, E.a  b  and Luo, X.a  and Qin, Z.a;2014;We present a hybrid method for aspect-based sentiment analysis of Chinese restaurant reviews. Two main components are employed so as to extract feature-opinion pairs in the proposed method: domain independent language patterns found in Chinese and a lexical base built for restaurant reviews. The language patterns focus on the general knowledge which is implicit contained in Chinese, thus can be used directly by other domains without any modification. The lexical base, on the other hand, targets for particular characteristics of a given domain and acts as a plug-in part in our prototype system, thus does not affect the portability when applying the proposed approach in practice. Empirical evaluation shows that our method performs well and it can gain a progressive result when each component takes into effective. Â© 2014 Springer International Publishing.;Lecture Notes in Computer Science (including subseries Lecture Notes in Artificial Intelligence and Lecture Notes in Bioinformatics);Conference Paper;http://www.scopus.com/inward/record.url?eid=2-s2.0-84906976377&partnerID=40&md5=f62491b57682f4abef0e55858744be47;8655 LNAI;209-216;10.1007/978-3-319-10816-2_26;NULO;Excluir
1235;INDONESIAN SOCIAL MEDIA SENTIMENT ANALYSIS WITH SARCASM DETECTION;IEEE_B;IEEE;Lunando, E. and Purwarianti, A.;2013;Sarcasm is considered one of the most difficult problem in sentiment analysis. In our observation on Indonesian social media, for certain topics, people tend to criticize something using sarcasm. Here, we proposed two additional features to detect sarcasm after a common sentiment analysis is conducted. The features are the negativity information and the number of interjection words. We also employed translated SentiWordNet in the sentiment classification. All the classifications were conducted with machine learning algorithms. The experimental results showed that the additional features are quite effective in the sarcasm detection.;Advanced Computer Science and Information Systems (ICACSIS), 2013 International Conference on;NULO;NULO;NULO;195-198;10.1109/ICACSIS.2013.6761575;NULO;Excluir
1236;INFLUENCE FACTOR BASED OPINION MINING OF TWITTER DATA USING SUPERVISED LEARNING;SCOPUS;SCOPUS;Anjaria, M. and Guddeti, R.M.R.;2014;Social Networking portals have been widely used for expressing opinions in the public domain through internet based text messages and images. Among popular social networking portals, Twitter has been the point of attraction to several researchers in important areas like prediction of democratic electoral events, consumer brands, movie box office, stock market, popularity of celebrities etc. Sentiment analysis over Twitter offers a fast and efficient way of monitoring the public sentiment. In this paper, we introduce the novel approach of exploiting the user influence factor in order to predict the outcome of an election result. We also propose a hybrid approach of extracting opinion using direct and indirect features of Twitter data based on Support Vector Machines (SVM), Naive Bayes, Maximum Entropy and Artificial Neural Networks based supervised classifiers. We combined Principal Component Analysis (PCA) with SVM in an attempt to perform dimensionality reduction. This paper shows two different case studies of entirely different social scenarios, US Presidential Elections 2012 and Karnataka Assembly Elections 2013. We conclude the conditions under which Twitter may fail or succeed in predicting the outcome of elections. Experimental results demonstrate that Support Vector Machines outperform all other classifiers with maximum successful prediction accuracy of 88% in case of US Presidential Elections held in November 2012 and maximum prediction accuracy of 58% in case of Karnataka State Assembly Elections held in May 2013. Â© 2014 IEEE.;2014 6th International Conference on Communication Systems and Networks, COMSNETS 2014;Conference Paper;http://www.scopus.com/inward/record.url?eid=2-s2.0-84896803877&partnerID=40&md5=5f37c760a2fe88158c2df1914f9bd4df;NULO;NULO;10.1109/COMSNETS.2014.6734907;NULO;Excluir
1237;INTEGRATING SENTIMENT ANALYSIS AND TERM ASSOCIATIONS WITH GEO-TEMPORAL VISUALIZATIONS ON CUSTOMER FEEDBACK STREAMS;SCOPUS;SCOPUS;Hao, M.a  and Rohrdantz, C.b  and Janetzko, H.b  and Keim, D.b  and Dayal, U.a  and Haug, L.-E.a  and Hsu, M.-C.a;2012;Twitter currently receives over 190 million tweets (small text-based Web posts) and manufacturing companies receive over 10 thousand web product surveys a day, in which people share their thoughts regarding a wide range of products and their features. A large number of tweets and customer surveys include opinions about products and services. However, with Twitter being a relatively new phenomenon, these tweets are underutilized as a source for determining customer sentiments. To explore high-volume customer feedback streams, we integrate three time series-based visual analysis techniques: (1) feature-based sentiment analysis that extracts, measures, and maps customer feedback:, (2) a novel idea of term associations that identify attributes, verbs, and adjectives frequently occurring together:, and (3) new pixel cell-based sentiment calendars, geo-temporal map visualizations and self-organizing maps to identify co-occurring and influential opinions. We have combined these techniques into a well-fitted solution for an effective analysis of large customer feedback streams such as for movie reviews (e.g., Kung-Fu Panda) or web surveys (buyers). Â© 2012 SPIE-IS&T.;Proceedings of SPIE - The International Society for Optical Engineering;Conference Paper;http://www.scopus.com/inward/record.url?eid=2-s2.0-84857016004&partnerID=40&md5=2b2206a50597f10130ed573b5ea1aeb1;8294;NULO;10.1117/12.912202;NULO;Incluir
1238;INTEGRATION OF OPINION INTO CUSTOMER ANALYSIS MODEL;IEEE_B;IEEE;Yaakub, M.R. and Yuefeng Li and Yanming Feng;2011;Nowadays, Opinion Mining is getting more important than before especially in doing analysis and forecasting about customers behavior for businesses purpose. The right decision in producing new products or services based on data about customers characteristics means profit for organization/company. This paper proposes a new architecture for Opinion Mining, which uses a multidimensional model to integrate customers characteristics and their comments about products (or services). The key step to achieve this objective is to transfer comments (opinions) to a fact table that includes several dimensions, such as, customers, products, time and locations. This research presents a comprehensive way to calculate customers orientation for all possible products attributes. A use case study is also presented in this paper to show the advantages of using OLAP and data cubes to analyze costumers opinions.;e-Business Engineering (ICEBE), 2011 IEEE 8th International Conference on;NULO;NULO;NULO;90-95;10.1109/ICEBE.2011.53;NULO;Excluir
1239;INTERNET PUBLIC OPINION HOTSPOT DETECTION AND ANALYSIS BASED ON KMEANS AND SVM ALGORITHM;IEEE_B;IEEE;Hong Liu;2010;Rapid progress of network arouses much attention on Internet public opinion, it is important to grasp the internet public opinion in time and understand the trends of their opinion correctly. Text mining plays a fundamental role in categorization and monitoring of internet public opinion, but internet public opinion is much more difficult than pure-text process because of their semi-structured characteristic. To address this issue, we propose a model for internet public opinion hotspot detection and analysis. Due to the text format of internet public opinion, we introduce the traditional vector space model (VSM) to express them, and then use Kmeans algorithm to perform text clustering on a corpus collected from some news website, and use SVM classifier to perform text categorization for new text opinion analysis, the result of the experiment shows that the efficiency and effectiveness of such method.;Information Science and Management Engineering (ISME), 2010 International Conference of;NULO;NULO;1;257-261;10.1109/ISME.2010.207;NULO;Excluir
1240;INTERPRETING OR DESCRIBING? MEASURING VERB ABSTRACTION;IEEE_B;IEEE;Rogozinska, D. and Wawer, A.;2013;The paper describes the results of machine learning experiments with verb classification according to the Linguistic Category Model (LCM). The LCM typology is a well-established tool to measure language abstraction, linked to sentiment and applicable in sentiment-analysis related areas. Our goal is to create automated methods of recognizing LCM verb classes. The method, demonstrated in the Polish language, turns out to be very promising, especially given the upper bounds set by inter-annotator agreement.;Data Mining Workshops (ICDMW), 2013 IEEE 13th International Conference on;NULO;NULO;NULO;963-966;10.1109/ICDMW.2013.92;NULO;Excluir
1241;INVESTIGATING ANALYSIS OF SPEECH CONTENT THROUGH TEXT CLASSIFICATION;IEEE_B;IEEE;Ezzat, S. and Gayar, N.E. and Ghanem, M.M.;2010;The field of Text Mining has evolved over the past years to analyze textual resources. However, it can be used in several other applications. In this research, we are particularly interested in performing text mining techniques on audio materials after translating them into texts in order to detect the speakers emotions. We describe our overall methodology and present our experimental results. In particular, we focus on the different features selection and classification methods used. Our results show interesting conclusions opening up new horizons in the field, and suggest an emergence of promising future work yet to be discovered.;Soft Computing and Pattern Recognition (SoCPaR), 2010 International Conference of;NULO;NULO;NULO;105-110;10.1109/SOCPAR.2010.5686000;NULO;Excluir
1242;INVESTIGATING SENTIMENTAL RELATION BETWEEN SOCIAL MEDIA PRESENCE AND ACADEMIC SUCCESS OF TURKISH UNIVERSITIES;IEEE_B;IEEE;Gunduz, S. and Demirhan, F. and Sagiroglu, S.;2014;In this study an approach that uses social networking data for developing sentiment analysis system is proposed. With the help of developed software, it is tried to find out whether there is any relation between universities academic success and sentiment of the public about them in social media. After collecting enough text based data from Twitter, preprocessing of data is carried out and final data is trained by means of Nai¨ve Bayes Classifier. After testing process, experimental results have shown that developed sentiment analysis system can classify the tweets about top 10 universities according to URAP rankings in terms of their sentiment with the 72.33% success rate, and proposed methodology can be used by universities for understanding sentiment of the public about them in social media.;Machine Learning and Applications (ICMLA), 2014 13th International Conference on;NULO;NULO;NULO;574-579;10.1109/ICMLA.2014.95;NULO;Excluir
1243;IS A PICTURE WORTH 1000 VOTES? ANALYZING THE SENTIMENT OF ELECTION RELATED SOCIAL PHOTOS;IEEE_B;IEEE;Ge Ma and Jiebo Luo;2013;This paper explores techniques for automatically recognizing the sentiment of facial expressions in social photos, especially those of politicians in the context of elections. We first use the Active Shape Model (ASM) to extract facial feature points. Next, the shape model points from the ASM are normalized to a standard shape and then submitted to a trained AdaBoost classifier to recognize the sentiment of facial expressions. Three types of sentiment are of primary interest: flattering, neutral and unflattering. Finally, the approach is evaluated by experiments, which indicate that the proposed method is sufficiently effective for facial expression analysis of images of election candidates and thus can be used to gauge the public opinion during the election.;Multimedia and Expo (ICME), 2013 IEEE International Conference on;NULO;NULO;NULO;1-6;10.1109/ICME.2013.6607633;1945-7871;Excluir
