artigo_id_unico;titulo_unico;consulta_nome;base;autores;ano;abstract;journal;tipo_documento2;url;volume;pages;ISSN_ISBN;DOI;Excluir-2revisores2
1318;PROBABILISTIC MODEL-BASED SENTIMENT ANALYSIS OF TWITTER MESSAGES;IEEE_A;IEEE;Celikyilmaz, A. and Hakkani-Tur, D. and Junlan Feng;2010;We present a machine learning approach to sentiment classification on twitter messages (tweets). We classify each tweet into two categories: polar and non-polar. Tweets with positive or negative sentiment are considered polar. They are considered non-polar otherwise. Sentiment analysis of tweets can potentially benefit different parties, such as consumers and marketing researchers, for obtaining opinions on different products and services. We present methods for text normalization of the noisy tweets and their classification with respect to the polarity. We experiment with a mixture model approach for generation of sentimental words, which are later used as indicator features of the classification model. Based on a gold standard manually annotated ensemble of tweets, with the new approach, we obtain F-scores that are relatively 10% better than a classification baseline that uses raw word n-gram features.;Spoken Language Technology Workshop (SLT), 2010 IEEE;NULO;NULO;NULO;79-84;10.1109/SLT.2010.5700826;NULO;Excluir
1319;PROBABILISTIC RANKING OF PRODUCT FEATURES FROM CUSTOMER REVIEWS;SCOPUS;SCOPUS;GarcÃ­a-Moya, L. and Anaya-SÃ¡nchez, H. and Berlanga, R. and Aramburu, M.J.;2011;In this paper, we propose a methodology for obtaining a probabilistic ranking of product features from a customer review collection. Our approach mainly relies on an entailment model between opinion and feature words, and suggest that in a probabilistic opinion model of words learned from an opinion corpus, feature words must be the most probable words generated from that model (even more than opinion words themselves). In this paper, we also devise a new model for ranking corpus-based opinion words. We have evaluated our approach on a set of customer reviews of five products obtaining encouraging results. Â© 2011 Springer-Verlag.;Lecture Notes in Computer Science (including subseries Lecture Notes in Artificial Intelligence and Lecture Notes in Bioinformatics);Conference Paper;http://www.scopus.com/inward/record.url?eid=2-s2.0-79959958802&partnerID=40&md5=2cdc16c541ec886143e8b80b221861be;6669 LNCS;208-215;10.1007/978-3-642-21257-4_26;NULO;Incluir
1320;PRODUCT ASPECT EXTRACTION SUPERVISED WITH ONLINE DOMAIN KNOWLEDGE;SCIENCE_DIRECT;SCIENCE_DIRECT;Tao Wang and Yi Cai and Ho-fung Leung and Raymond Y.K. Lau and Qing Li and Huaqing Min;2014;Abstract One of the most challenging problems in aspect-based opinion mining is aspect extraction, which aims to identify expressions that describe aspects of products (called aspect expressions) and categorize domain-specific synonymous expressions. Although a number of methods of aspect extraction have been proposed before, very few of them are designed to improve the interpretability of generated aspects. Existing methods either generate multiple fine-grained aspects without proper categorization or categorize semantically unrelated product aspects (e.g., by unsupervised topic modeling). In this paper, we first examine previous studies on product aspect extraction. To overcome the limitations of existing methods, two novel semi-supervised models for product aspect extraction are then proposed. More specifically, the proposed methodology first extracts seeding aspects and related terms from detailed product descriptions readily available on E-commerce websites. Next, product reviews are regrouped according to these seeding aspects so that more effective textual contexts for topic modeling are built. Finally, two novel semi-supervised topic models are developed to extract human-comprehensible product aspects. For the first proposed topic model, the Fine-grained Labeled \{LDA\} (FL-LDA), seeding aspects are applied to guide the model to discover words that are related to these seeding aspects. For the second model, the Unified Fine-grained Labeled \{LDA\} (UFL-LDA), we incorporate unlabeled documents to extend the FL-LDA model so that words related to the seeding aspects or other high-frequency words in customer reviews are extracted. Our experimental results demonstrate that the proposed methods outperform state-of-the-art methods.;Knowledge-Based Systems;NULO;http://www.sciencedirect.com/science/article/pii/S0950705114002081;71;86 - 100;http://dx.doi.org/10.1016/j.knosys.2014.05.018;0950-7051;Incluir
1321;PRODUCT EVALUATION USING MINING AND RATING OPINIONS OF PRODUCT FEATURES;IEEE_B;IEEE;Karkare, V.Y. and Gupta, S.R.;2014;Because of increase in social networking, more and more people are connected. The people use to share information using these sites and also through the personal blogs. This information sharing is done globally. As the Internet Technology is becoming reliable, people feel safe while sharing the information. Other than messages and photos, this information also includes opinions, experiences and feedbacks regarding any product. These opinions and feedbacks are very important for the organizations that are selling or manufacturing the products, which can be used for changing designs, personalization and better understanding of product. This information is very useful for people or customer for buying the product. But for a customer, it is very difficult to review all the opinions or feedbacks available on net for a particular product. So, data mining approaches are used to mine the opinions, perform summarization of reviews for a particular product based on features or any other category. Most of the existing methods are processing the reviews in terms of positive and negative comments. But this approach is not enough for a customer to make decision about product. The proposed approach not only finding the positive and negative comments for any product or product features, but also rating them in the order of positivity and negativity. Also, the proposed approach gives the degree of comparisons for a particular product and product features.;Electronic Systems, Signal Processing and Computing Technologies (ICESC), 2014 International Conference on;NULO;NULO;NULO;382-385;10.1109/ICESC.2014.72;NULO;Incluir
1322;PRODUCT FEATURE CATEGORIZATION WITH MULTILEVEL LATENT SEMANTIC ASSOCIATION;ACM;ACM;Guo, Honglei and Zhu, Huijia and Guo, Zhili and Zhang, XiaoXun and Su, Zhong;2009;In recent years, the number of freely available online reviews is increasing at a high speed. Aspect-based opinion mining technique has been employed to find out reviewers opinions toward different product aspects. Such finer-grained opinion mining is valuable for the potential customers to make their purchase decisions. Product-feature extraction and categorization is very important for better mining aspect-oriented opinions. Since people usually use different words to describe the same aspect in the reviews, product-feature extraction and categorization becomes more challenging. Manually product-feature extraction and categorization is tedious and time consuming, and practically infeasible for the massive amount of products. In this paper, we propose an unsupervised product-feature categorization method with multilevel latent semantic association. After extracting product-features from the semi-structured reviews, we construct the first latent semantic association (LaSA) model to group words into a set of concepts according to their virtual context documents. It generates the latent semantic structure for each product-feature. The second LaSA model is constructed to categorize the product-features according to their latent semantic structures and context snippets in the reviews. Experimental results demonstrate that our method achieves better performance compared with the existing approaches. Moreover, the proposed method is language- and domain-independent.;Proceedings of the 18th ACM Conference on Information and Knowledge Management;NULO;http://doi.acm.org/10.1145/1645953.1646091;NULO;1087--1096;10.1145/1645953.1646091;978-1-60558-512-3;Incluir
1323;PRODUCT FEATURE GROUPING FOR OPINION MINING;IEEE_B;IEEE;Zhongwu Zhai and Bing Liu and Jingyuan Wang and Hua Xu and Peifa Jia;2012;Review aggregators and e-commerce sites are just two examples of businesses that rely on opinion mining to produce feature-based summaries of products qualities. This model first identifies product features and then collects positive and negative opinions on them to produce a summary of good and bad points.;Intelligent Systems, IEEE;NULO;NULO;27;37-44;10.1109/MIS.2011.38;1541-1672;Incluir
1324;PRODUCT FEATURE MINING WITH NOMINAL SEMANTIC STRUCTURE;IEEE_B;IEEE;Tian-jie Zhan and Chun-Hung Li;2010;Opinion mining is of great significance in the analysis of user generated content. While there is some progress in supervised classification of opinion, the unsupervised learning of product features has drawn less attention. Unlike previous approaches based on basic syntactic pattern, our product feature mining utilizes syntactic dependency knowledge in a novel way by discriminating nominal and non-nominal terms. A nominal semantic structure will be parsed based on a dependency tree together with our model treating non-nominal terms as the semantic neighbors of the associated nominal terms. The semantic structure parsing will produce an opinionated pair stream with couples of nominal terms and its semantic neighbors, based on which fine-grained product features can be obtained by co-clustering approach via factorization method. Evaluation on average cluster entropies, perplexity and manual evaluation demonstrated advantage of our model. Product features highly cohesive in fine-grain are extracted automatically.;Web Intelligence and Intelligent Agent Technology (WI-IAT), 2010 IEEE/WIC/ACM International Conference on;NULO;NULO;1;464-467;10.1109/WI-IAT.2010.121;NULO;Incluir
1325;PRODUCT FEATURE TAXONOMY LEARNING BASED ON USER REVIEWS;SCOPUS;SCOPUS;Tian, N.a  and Xu, Y.a  and Li, Y.a  and Abdel-Hafez, A.a  and Josang, A.b;2014;In recent years, the Web 2.0 has provided considerable facilities for people to create, share and exchange information and ideas. Upon this, the user generated content, such as reviews, has exploded. Such data provide a rich source to exploit in order to identify the information associated with specific reviewed items. Opinion mining has been widely used to identify the significant features of items (e.g., cameras) based upon user reviews. Feature extraction is the most critical step to identify useful information from texts. Most existing approaches only find individual features about a product without revealing the structural relationships between the features which usually exist. In this paper, we propose an approach to extract features and feature relationships, represented as a tree structure called feature taxonomy, based on frequent patterns and associations between patterns derived from user reviews. The generated feature taxonomy profiles the product at multiple levels and provides more detailed information about the product. Our experiment results based on some popularly used review datasets show that our proposed approach is able to capture the product features and relations effectively.;WEBIST 2014 - Proceedings of the 10th International Conference on Web Information Systems and Technologies;Conference Paper;http://www.scopus.com/inward/record.url?eid=2-s2.0-84902366380&partnerID=40&md5=de327d198cb5a872e8474c7c7af4e6e5;2;184-192;NULO;NULO;Incluir
1326;PRODUCT FEATURES MINING BASED ON CONDITIONAL RANDOM FIELDS MODEL;IEEE_B;IEEE;Bing Xu and Tie-Jun Zhao and De-quan Zheng and Shan-Yu Wang;2010;Opinion mining has become a hot issue attracting the attention of many researchers recently, in which the opinion feature is essential to its modeling. In the opinion mining of products, opinion feature identification is to mine product features from product reviews. In this paper, we present a Conditional Random Fields model based Chinese product features identification approach, integrating the chunk features and heuristic position information in addition to the word features, part-of-speech features and context features. Experiments show that the proposed techniques effectively improve the performance of product opinion mining.;Machine Learning and Cybernetics (ICMLC), 2010 International Conference on;NULO;NULO;6;3353-3357;10.1109/ICMLC.2010.5580679;NULO;Excluir
1327;PRODUCT REVIEW INFORMATION EXTRACTION BASED ON ADJECTIVE OPINION WORDS;IEEE_B;IEEE;Yan Luo and Wei Huang;2011;Product review mining can provide effective help for manufacturers, retailers and potential customers. We propose a framework of product review information extraction based on adjective opinion words. Firstly, we extract the web page information with web page template features. Secondly, we manually label seed adjective opinion word set, and expanded it to a set with words coverage reaching 90%. We also identify comparative sentence, word match and negation patterns. Finally, we summarize the product reviews from the various perspectives. In order to demonstrate our methods of the framework, we conduct the experiment with the product reviews of digital camera from www. Epinions.com. The experiment shows that the methods can provide the number of emotion polarity for the products and features.;Computational Sciences and Optimization (CSO), 2011 Fourth International Joint Conference on;NULO;NULO;NULO;1309-1313;10.1109/CSO.2011.209;NULO;Excluir
1328;PROMOTING PRODUCTS ONLINE USING FIREFLY ALGORITHM;IEEE_B;IEEE;Banati, H. and Bajaj, M.;2012;Opinions on various products are often shared by web users through online social media. These opinions play an important role in decision making criterion for prospective customers. This sharing of experiences works as electronic -word of mouth (e-WOM) publicity for a product in the internet world. The paper presents a distinct e-marketing strategy that takes advantage of attraction mechanism of firefly algorithm along with quick spread behavior of e-WOM for market campaigning. Firefly algorithm is inspired by biochemical and social aspects of real fireflies. The proposed approach analysis the current trend of market in terms of relevant product features. The user interest towards those features is extracted by mining their opinions. Subsequently market segmentation is done by clustering similar users and best segment(s) is selected for product promotion. The strategy finally exploits the social connectedness among online users to identify the best initial seeds. Thus the proposed approach is capable of attracting the attention of a large span of web users by employing a small fraction of advertising budget and has a potential in current e-marketing scenario.;Intelligent Systems Design and Applications (ISDA), 2012 12th International Conference on;NULO;NULO;NULO;580-585;10.1109/ISDA.2012.6416602;2164-7143;Excluir
1329;PROXIMITY-BASED SENTIMENT ANALYSIS;IEEE_A;IEEE;Hasan, S.M.S. and Adjeroh, D.A.;2011;Sentiment analysis seeks to characterize opinionated or evaluative aspects of natural language text thus helping people to discover valuable information from large amounts of unstructured data [1]. In this paper we explore a new methodology for sentiment analysis called proximity-based sentiment analysis. We take a different approach, by considering a new set of features based on word proximities in a written text. We propose three proximity-based features, namely, proximity distribution, mutual information between proximity types, and proximity patterns. We applied this approach to the analysis of movie reviews. Our experimental results show that proximity-based sentiment analysis is able to extract sentiments from a specific domain, with performance comparable to the state-of-the-art. To the best of our knowledge, this is the first attempt at focusing on only proximity based features as the primary features in sentiment analysis.;Applications of Digital Information and Web Technologies (ICADIWT), 2011 Fourth International Conference on the;NULO;NULO;NULO;106-111;10.1109/ICADIWT.2011.6041410;NULO;Excluir
1330;QUALITY EVALUATION OF PRODUCT REVIEWS USING AN INFORMATION QUALITY FRAMEWORK;SCOPUS;SCOPUS;Chen, C.C. and Tseng, Y.-D.;2011;The ubiquity of Web2.0 makes the Web an invaluable source of business information. For instance, product reviews composed collaboratively by many independent Internet reviewers can help consumers make purchase decisions and enable enterprises to improve their business strategies. As the number of reviews is increasing exponentially, opinion mining and retrieval techniques are needed to identify important reviews and opinions to answer users queries. Most opinion mining and retrieval approaches try to extract sentimental or bipolar expressions from a large volume of reviews. However, the process often ignores the quality of each review and may retrieve useless or even noisy documents. In this paper, we propose a method for evaluating the quality of information in product reviews. We treat the evaluation of review quality as a classification problem and employ an effective information quality framework to extract representative review features. Experiments based on an expert-composed data corpus demonstrate that the proposed method outperforms state-of-the-art approaches significantly. Â© 2010 Elsevier B.V. All rights reserved.;Decision Support Systems;Article;http://www.scopus.com/inward/record.url?eid=2-s2.0-79151475526&partnerID=40&md5=95fbe64384735e203821dcb77f71aa56;50;755-768;10.1016/j.dss.2010.08.023;NULO;Excluir
1331;RECIPE POPULARITY PREDICTION BASED ON THE ANALYSIS OF SOCIAL REVIEWS;IEEE_B;IEEE;Xudong Mao and Yanghui Rao and Qing Li;2013;In social based Web services systems, some resources gain popularity while others do not. It would be valuable if we can predict the popularity of certain resource. In this work, we study the recipe popularity prediction problem using the Yelp dataset. We investigate various features that can be extracted and help to improve the performance. In particular, we propose to do the sentiment analysis over the reviews and treat the sentimental scores as one of the features. A polynomial regression model is developed to predict the recipe popularity. The experimental results show that our proposed method outperforms the baseline method.;Awareness Science and Technology and Ubi-Media Computing (iCAST-UMEDIA), 2013 International Joint Conference on;NULO;NULO;NULO;568-573;10.1109/ICAwST.2013.6765504;NULO;Excluir
1332;RECOMMENDED OR NOT RECOMMENDED? REVIEW CLASSIFICATION THROUGH OPINION EXTRACTION;IEEE_B;IEEE;Sheng Feng and Ming Zhang and Yanxing Zhang and Zhihong Deng;2010;With the rapid growth of web 2.0, online product reviews generated by users are becoming increasingly useful for customers to make purchase decisions. In this paper, we focus on the problem of classifying user reviews as recommended the product or not. The proposed method first mines the product features and relevant opinions, and then determines the overall sentiment orientation of the review based on the polarity and strength of these opinions. The evaluation results show the effectiveness of our proposed method in product feature mining and review classification.;Web Conference (APWEB), 2010 12th International Asia-Pacific;NULO;NULO;NULO;350-352;10.1109/APWeb.2010.38;NULO;Excluir
1333;REPRESENTING AND RESOLVING NEGATION FOR SENTIMENT ANALYSIS;IEEE_B;IEEE;Lapponi, E. and Read, J. and Ovrelid, L.;2012;Proper treatment of negation is an important characteristic of methods for sentiment analysis. However, while there is a growing body of research on the automatic resolution of negation, it is not yet clear as to how negation is best represented for different applications. To begin to address this issue, we review representation alternatives and present a state-of-the-art system for negation resolution that is interoperable across these schemes. By employing different configurations of this system as a component in a test bed for lexically-based sentiment classification, we demonstrate that the choice of representation can have a significant impact on downstream processing.;Data Mining Workshops (ICDMW), 2012 IEEE 12th International Conference on;NULO;NULO;NULO;687-692;10.1109/ICDMW.2012.23;NULO;Excluir
1334;RESEARCH FOR PUBLIC OPINION OF CHARITABLE ORGANIZATIONS BASED ON MICROBLOGGING SENTIMENT ANALYSIS;SCOPUS;SCOPUS;Liu, Z.;2015;The microblogging has become the important platform for expressing emotion, therefore it is critical for charitable organizations to monitor the public opinion in microblogging. This paper studied the evolution of the public emotions during the charity events. Firstly, we constructed a hierarchical emotion model for events and an emotion monitoring surveillance model. Secondly, we used three machine learning algorithms and three kinds of feature selection methods to study the emotion classification for Chinese microblogging about the events. The experimental results show the performance of SVM and IG feature selection is best, and the accuracy of the classification is fit for need, then the paper discussed a charity event and analyses the evolution of emotions.;Journal of Information and Computational Science;Article;http://www.scopus.com/inward/record.url?eid=2-s2.0-84924798758&partnerID=40&md5=a14f822b27ba6b36a49c417fdf03cf90;12;1011-1019;10.12733/jics20105433;NULO;Excluir
1335;RESEARCH ON FEATURE EXTRACTION FROM CHINESE TEXT FOR OPINION MINING;IEEE_B;IEEE;Shanzong Zhu and Yuanchao Liu and Ming Liu and Peiliang Tian;2009;More and more users and manufacturers concern about product reviews on the web, but its difficult to quickly find interesting content from massive information. In order to mine sentiment polarity from review sentences, two approaches for product feature extraction and sentence opinion mining are proposed in this paper. Because of the characteristics of Chinese language, lexical analyzing tools are used to process review text, and association rule model is used to mine frequent items as candidate feature. In order to get better result, several filtering algorithms are proposed. Experiment results demonstrate that relation between the precision and recall rate of feature extraction task with different minimum support thresholds in association rules mining, and the promising performance of our approach has also been shown.;Asian Language Processing, 2009. IALP 09. International Conference on;NULO;NULO;NULO;7-10;10.1109/IALP.2009.11;NULO;Excluir
1336;RESEARCH ON OPINION MINING IN CHINESE BASED ON SEMANTIC ANALYSIS;SCOPUS;SCOPUS;Fang, L.;2011;Opinion Mining is a novel and important research topic, aiming to automatically acquire useful opinioned information and knowledge in subjective texts. Based on introduction to the task of opinion mining and its related work, the paper puts forward the framework of opinion mining in Chinese with semantic analysis, meanwhile some key techniques in the framework are studies. The paper also gives more details about the tasks of opinion mining in Chinese, which will provide the useful information for the subsequent research. Â© 2011 Springer-Verlag Berlin Heidelberg.;Advances in Intelligent and Soft Computing;Conference Paper;http://www.scopus.com/inward/record.url?eid=2-s2.0-84555206973&partnerID=40&md5=16c028d799299fc4285bd11ca116ceab;119;491-498;10.1007/978-3-642-25538-0_69;NULO;Excluir
1337;RESEARCH ON THE AUTOMATIC EVALUATION OF MERCHANDISE COMMENTS ON BLOGS;IEEE_B;IEEE;Qian Liping and Yang Xiaoping and Wang Lidong;2010;Opinionated content in Blog comments usually has a positive or a negative or a neutral connotation. This paper researches on the automatic evaluation of Blog comments on merchandise. It builds a meta-search engine for retrieving Blog pages with merchandise comments. The retrieved pages are parsed:, the comment texts are drawn out and serve as resources for corpus. By means of feature extraction and polarity analysis, these comments text are represented with SVM. In polarity analyzing, a dictionary of merchandise attributes and a lexicon of positive and negative words are constructed to improve the accuracy. The average score of specific product is calculated based on the polarity score of each merchandise attribute and the percentage of people who gives positive comment. We build a prototype system AESBC and conduct comparison study between the result of our experimental system and that of field experts. The experimental result shows the effectiveness of our method.;Web Information Systems and Mining (WISM), 2010 International Conference on;NULO;NULO;1;293-296;10.1109/WISM.2010.57;NULO;Excluir
1338;RESTRICTED DOMAIN OPINION MINING IN COMPOUND SENTENCES;IEEE_B;IEEE;Mishra, N. and Jha, C.K.;2013;The growing availability of opinion rich resources like online review sites and blogs arises as people can easily seek out and understand the opinions of others. Users express their views and opinions that could be simple or compound sentence which is related to the products and services. These opinions are subjective information which represents users sentiments, feelings or appraisal related to the same. With respect to compound sentences there are number of problems in opinion mining such as identification of object features, their individual sentiments and sentiments of overall object as a whole. This paper is an extension to our work on semantic question answering in which we identify the score of the asked feature by deriving it from the question through opinion mining in compound sentences. Our method shows significant improvement on movie-review dataset.;Communication Systems and Network Technologies (CSNT), 2013 International Conference on;NULO;NULO;NULO;616-620;10.1109/CSNT.2013.132;NULO;Excluir
